{
  "capabilities": [
    "catalog-component-set/v1",
    "composition/v1",
    "composition/v2",
    "composition/v3",
    "helper-package-companion/v1",
    "managed-deployment/v1",
    "managed-python-runtime/v1",
    "provider-fanout/v1",
    "provider-gate/v1",
    "provider-targets/v1",
    "system-launchdaemon/v1"
  ],
  "channel": "stable",
  "installer_version": "0.4.20",
  "policy_revision": "forge-platform-installer-release-v1",
  "provenance_sha256": "5d5d711292c1be9ab430413213b9735ffca1cfc76a0a63dea50e881a3ea2dcd1",
  "release_sequence": 42,
  "release_trust_configuration_sha256": "77ac8c339abf6f2bc12144504fe7146ed0d89643bd384538500601bd2c4f207a",
  "schema_version": 1,
  "source_revision": "07d3b8d29091410bd6b4928a3f654bb8eed7e8d2"
}
